{
  "$schema": "./schema/prices.schema.json",
  "_comment": "API list prices per model, USD per 1M tokens, standard (non-batch) tier, as listed on the provider's own pricing page on the 'checked' date. Used only to estimate cost for harnesses that don't report one; estimates are always labeled as such (docs/SITE-DATA.md, CostInfo). Not part of the registry version hash. Leave a model out when its official page doesn't list it. 'long_context' holds the higher prices a request pays when its prompt is over 'above' tokens, where the provider lists them; a model without it has one price at every size.",
  "currency": "USD",
  "unit": "per_million_tokens",
  "prices": [
    { "model": "claude-fable-5-1", "from": "2026-09-01", "input": 10, "output": 50, "cache_read": 0.25, "cache_write": 12.5, "cache_write_1h": 20, "source": "https://platform.claude.com/docs/en/about-claude/pricing", "checked": "2026-10-22", "note": "cache_write is the 5-minute write ($20 for 1 hour). Full 1M context at the same rate (no long-context tier)." },
    { "model": "claude-opus-5-5", "from": "2026-09-22", "input": 4, "output": 20, "cache_read": 0.2, "cache_write": 5, "cache_write_1h": 8, "source": "https://platform.claude.com/docs/en/about-claude/pricing", "checked": "2026-10-22", "note": "cache_write is the 5-minute write ($8 for 1 hour). Full 1M context at the same rate (no long-context tier). Fast mode costs more ($8 / $40)." },
    { "model": "claude-sonnet-5-5", "from": "2026-09-28", "input": 2, "output": 10, "cache_read": 0.1, "cache_write": 2.5, "cache_write_1h": 4, "source": "https://platform.claude.com/docs/en/about-claude/pricing", "checked": "2026-10-22", "note": "cache_write is the 5-minute write ($4 for 1 hour). Full 1M context at the same rate (no long-context tier)." },
    { "model": "claude-haiku-5-5", "from": "2026-10-07", "input": 0.1, "output": 0.5, "cache_read": 0.01, "cache_write": 0.125, "cache_write_1h": 0.2, "long_context": { "above": 100000, "input": 0.5, "output": 2.5, "cache_read": 0.05, "cache_write": 0.625, "cache_write_1h": 1 }, "source": "https://platform.claude.com/docs/en/about-claude/pricing", "checked": "2026-10-22", "note": "cache_write is the 5-minute write ($0.20 for 1 hour; $1 over 100,000). Prompt length counts cache reads and writes; a request over 100,000 tokens pays the higher prices on all of it." },
    { "model": "gpt-6-astra", "from": "2026-09-03", "input": 10, "output": 50, "cache_read": 1, "cache_write": 12.5, "long_context": { "above": 272000, "input": 20, "output": 75, "cache_read": 2, "cache_write": 25 }, "source": "https://developers.openai.com/api/docs/pricing", "checked": "2026-10-22", "note": "Standard tier; cache_write is the 30-minute write. Long context is '>272K input tokens'; the page doesn't say whether cached input counts or the whole request pays it (assumed: both, as on the other providers)." },
    { "model": "gpt-6.1-sol", "from": "2026-09-29", "input": 2, "output": 10, "cache_read": 0.1, "cache_write": 2.5, "long_context": { "above": 272000, "input": 4, "output": 15, "cache_read": 0.2, "cache_write": 5 }, "source": "https://developers.openai.com/api/docs/pricing", "checked": "2026-10-22", "note": "Standard tier; cache_write is the 30-minute write. Long context is '>272K input tokens'; the page doesn't say whether cached input counts or the whole request pays it (assumed: both, as on the other providers)." },
    { "model": "gpt-6-luna", "from": "2026-09-22", "input": 0.1, "output": 0.5, "cache_read": 0.01, "cache_write": 0.125, "long_context": { "above": 272000, "input": 0.2, "output": 0.75, "cache_read": 0.02, "cache_write": 0.25 }, "source": "https://developers.openai.com/api/docs/pricing", "checked": "2026-10-22", "note": "Standard tier; cache_write is the 30-minute write. Long context is '>272K input tokens'; the page doesn't say whether cached input counts or the whole request pays it (assumed: both, as on the other providers)." },
    { "model": "gpt-6-sol", "from": "2026-09-22", "input": 2, "output": 10, "cache_read": 0.2, "cache_write": 2.5, "long_context": { "above": 272000, "input": 4, "output": 15, "cache_read": 0.4, "cache_write": 5 }, "source": "https://developers.openai.com/api/docs/pricing", "checked": "2026-10-22", "note": "Standard tier; cache_write is the 30-minute write ($5 for 12 hours). Long context is '>272K input tokens' (pricing page); the model pages say the full request pays the higher prices." },
    { "model": "gpt-5.6-sol", "from": "2026-08-21", "input": 4, "output": 20, "cache_read": 0.4, "cache_write": 5, "long_context": { "above": 272000, "input": 8, "output": 30, "cache_read": 0.8, "cache_write": 10 }, "source": "https://developers.openai.com/api/docs/pricing", "checked": "2026-10-22", "note": "Promotional price 'at least through November 21, 2026' (changelog, Aug 21, 2026); no end date set, regular price not listed. Standard tier; cache_write is the 30-minute write. Long context is '>272K input tokens'; the full request pays it." },
    { "model": "gpt-5.6-terra", "from": "2026-07-30", "input": 2, "output": 12, "cache_read": 0.2, "cache_write": 2.5, "long_context": { "above": 272000, "input": 4, "output": 18, "cache_read": 0.4, "cache_write": 5 }, "source": "https://developers.openai.com/api/docs/pricing", "checked": "2026-10-22", "note": "Price since the Jul 30, 2026 cut ('GPT-5.6 Terra costs 20% less'; the earlier price isn't listed). Standard tier; cache_write is the 30-minute write. Long context is '>272K input tokens' (pricing page); the model pages say the full request pays the higher prices." },
    { "model": "gpt-5.6-luna", "from": "2026-07-30", "input": 0.2, "output": 1.2, "cache_read": 0.02, "cache_write": 0.25, "long_context": { "above": 272000, "input": 0.4, "output": 1.8, "cache_read": 0.04, "cache_write": 0.5 }, "source": "https://developers.openai.com/api/docs/pricing", "checked": "2026-10-22", "note": "Price since the Jul 30, 2026 cut ('GPT-5.6 Luna costs 80% less'; the earlier price isn't listed). Standard tier; cache_write is the 30-minute write. Long context is '>272K input tokens' (pricing page); the model pages say the full request pays the higher prices." },
    { "model": "gpt-5.5", "from": "2026-04-24", "input": 5, "output": 30, "cache_read": 0.5, "cache_write": null, "long_context": { "above": 272000, "input": 10, "output": 45, "cache_read": 1, "cache_write": null }, "source": "https://developers.openai.com/api/docs/pricing", "checked": "2026-10-22", "note": "Standard tier. No cache-write price is listed ('-'), so writes are estimated at the input price. Long context is '>272K input tokens' (pricing page); the model pages say the full request pays the higher prices." },
    { "model": "gemini-4-argon", "from": "2026-10-13", "until": "2026-12-01", "input": 2, "output": 10, "cache_read": 0.1, "cache_write": null, "source": "https://ai.google.dev/gemini-api/docs/pricing", "checked": "2026-10-22", "note": "Launch price through Nov 30, 2026; one price at every prompt size. Cache storage is billed per hour, not per written token." },
    { "model": "gemini-4-argon", "from": "2026-12-01", "input": 4, "output": 20, "cache_read": 0.2, "cache_write": null, "source": "https://ai.google.dev/gemini-api/docs/pricing", "checked": "2026-10-22", "note": "Listed price from Dec 1, 2026; one price at every prompt size." },
    { "model": "gemini-3.8-flash", "from": "2026-09-02", "until": "2027-01-01", "input": 0.75, "output": 3.75, "cache_read": 0.075, "cache_write": null, "source": "https://ai.google.dev/gemini-api/docs/pricing", "checked": "2026-10-22", "note": "Launch price through Dec 31, 2026; one price at every prompt size. Cache storage is billed per hour." },
    { "model": "gemini-3.8-flash", "from": "2027-01-01", "input": 1.5, "output": 7.5, "cache_read": 0.15, "cache_write": null, "source": "https://ai.google.dev/gemini-api/docs/pricing", "checked": "2026-10-22", "note": "Listed price from Jan 1, 2027; one price at every prompt size." },
    { "model": "gemini-3.1-pro-preview", "from": "2026-02-19", "input": 2, "output": 12, "cache_read": 0.2, "cache_write": null, "long_context": { "above": 200000, "input": 4, "output": 18, "cache_read": 0.4, "cache_write": null }, "source": "https://ai.google.dev/gemini-api/docs/pricing", "checked": "2026-10-22", "note": "Long context is 'prompts > 200k tokens'. Cache storage is billed per hour ($4.50 per 1M tokens per hour)." },
    { "model": "grok-4.7", "from": "2026-09-21", "input": 2, "output": 6, "cache_read": 0.5, "cache_write": null, "long_context": { "above": 200000, "input": 4, "output": 12, "cache_read": 1, "cache_write": null }, "source": "https://docs.x.ai/developers/pricing", "checked": "2026-10-22", "note": "Long context: the pricing table bills a request whose prompt reaches 200k tokens at the higher rate for all its tokens (the model page says 'exceed'). No cache-write price. Grok 4.7 Fast (Cursor, Grok Build only) costs more ($4 / $12, $6 / $18 long)." },
    { "model": "grok-4.6", "from": "2026-08-12", "input": 2, "output": 6, "cache_read": 0.5, "cache_write": null, "long_context": { "above": 200000, "input": 4, "output": 12, "cache_read": 1, "cache_write": null }, "source": "https://docs.x.ai/developers/pricing", "checked": "2026-10-22", "note": "Long context: a request whose prompt reaches 200k tokens pays the higher rate on all its tokens. No cache-write price." },
    { "model": "grok-4.5", "from": "2026-07-16", "input": 2, "output": 6, "cache_read": 0.3, "cache_write": null, "long_context": { "above": 200000, "input": 4, "output": 12, "cache_read": 0.6, "cache_write": null }, "source": "https://docs.x.ai/developers/pricing", "checked": "2026-10-22", "note": "Long context: a request whose prompt reaches 200k tokens pays the higher rate on all its tokens. No cache-write price." },